{
  "schema_version": "gsc-search-details-v1",
  "collector_version": "gsc-search-analytics-v1.1",
  "publication_id": "65c0b6e43f5dedf39e0011e8",
  "date_range": {
    "start_date": "2026-08-13",
    "end_date": "2026-08-14"
  },
  "page_expression": "https://www.lmdev.org/wpblog/apple-m5-max%e3%81%a7mlflow%e5%85%ac%e5%bc%8fhyperparameter-tuning%e3%82%92%e5%ae%9f%e8%b7%b5%e3%81%99%e3%82%8b-optuna%e3%81%a7%e3%83%8f%e3%82%a4%e3%83%91%e3%83%bc%e3%83%91%e3%83%a9%e3%83%a1/",
  "dimensions": [
    "query",
    "device",
    "country"
  ],
  "row_count": 0,
  "rows": [],
  "limitations": [
    "Search Analytics APIは全Rowではなく上位Rowを返す場合があります。",
    "Privacy保護により一部Queryが省略される場合があります。"
  ],
  "detail_sha256": "97e3a1543e8abe4a5371e162ec1c9e618fddf8be53e90afab9fe9e780fb3ac61"
}
